review,label
This product is amazing and works perfectly,1
I absolutely love this item,1
Very satisfied with the purchase,1
The quality is excellent and worth the money,1
Fantastic experience using this product,1
Super happy with the performance,1
Great value for the price,1
This is one of the best things I have bought,1
Highly recommended to everyone,1
The design and quality are outstanding,1
Really impressed with this product,1
Works exactly as described,1
Excellent build quality and performance,1
Very reliable and easy to use,1
Totally worth buying,1
Amazing product and fast delivery,1
The features are very useful,1
I would definitely buy this again,1
Customer service was excellent,1
This exceeded my expectations,1
Very durable and well made,1
Love the design and functionality,1
The product is fantastic,1
Perfect for daily use,1
Great quality and very comfortable,1
I am extremely satisfied with this purchase,1
This works better than expected,1
The product performs really well,1
Very good and easy to handle,1
This item is just perfect,1
The quality is superb,1
I enjoy using this product every day,1
One of the best purchases I made,1
Really great product overall,1
Five stars for this item,1
Totally impressed with the quality,1
Everything works perfectly,1
Excellent product and great support,1
Super useful and practical,1
Great experience using it,1
Absolutely wonderful purchase,1
Very happy with the product,1
Great design and performance,1
This item exceeded my expectations,1
Very impressive quality,1
The product is reliable and durable,1
This works flawlessly,1
I am really happy with this item,1
Great product for everyday use,1
Worth every penny,1
This product is terrible and useless,0
Very disappointed with the quality,0
It stopped working after one day,0
Waste of money,0
The product is poorly made,0
Completely dissatisfied with this item,0
The quality is very bad,0
I regret buying this product,0
Worst purchase I have made,0
Not worth the price at all,0
The item broke very quickly,0
Very poor performance,0
It does not work as expected,0
Extremely bad experience,0
The product arrived damaged,0
Cheap materials and poor design,0
Totally disappointed with this purchase,0
I will never buy this again,0
The product is defective,0
Terrible customer support,0
Very low quality product,0
This item is awful,0
It stopped functioning after a week,0
The design is bad and uncomfortable,0
Does not match the description,0
Really unhappy with this purchase,0
Not recommended at all,0
The build quality is terrible,0
This product failed completely,0
Extremely frustrating to use,0
Poorly designed product,0
I expected much better quality,0
It feels very cheap,0
Very disappointing experience,0
Totally useless product,0
I want my money back,0
The product is very unreliable,0
Bad purchase decision,0
Worst quality ever,0
Very unhappy with this item,0
Not satisfied at all,0
Terrible value for money,0
I hate this product,0
Completely useless and broken,0
Very frustrating to use,0
The product does not work properly,0
Poor craftsmanship,0
Bad quality materials,0
It failed within days,0
Extremely poor performance,0
I do not recommend this product,0
